{
  "schemaVersion": "1.0",
  "labId": "synthetic-lab",
  "tenantId": "11111111-1111-1111-1111-111111111111",
  "subscriptionId": "22222222-2222-2222-2222-222222222222",
  "location": "eastus2",
  "labResourceGroup": "rg-synthetic-lab",
  "identityResourceGroup": "rg-synthetic-identity",
  "deploymentIdentityName": "id-synthetic-deploy",
  "repository": "synthetic-org/synthetic-lab",
  "environment": "lab",
  "branch": "main",
  "profile": "baseline",
  "reviewers": [{ "type": "Team", "id": 12345 }],
  "runtime": null
}
